{
  "schemaVersion": "1.0.0",
  "snapshotId": "snapshot_demo_42",
  "sourceDeviceId": "mac_demo",
  "sourceEpoch": "epoch_demo",
  "sourceSequence": 42,
  "capturedAt": "2026-09-05T01:41:00Z",
  "windows": [
    {
      "id": "codex-primary",
      "providerId": "codex",
      "accountId": "account_demo",
      "accountAlias": "个人账户",
      "quotaKey": "primary",
      "sharedPoolId": null,
      "unit": "percent",
      "currency": null,
      "availability": "unavailable",
      "remainingBps": null,
      "amount": null,
      "limit": null,
      "quality": "unknown",
      "sourceMethod": "local_rpc",
      "fetchOutcome": "ok",
      "observedAt": null,
      "staleAt": null,
      "window": {
        "kind": "unknown",
        "durationSeconds": null,
        "startsAt": null,
        "resetsAt": null,
        "periodId": null
      },
      "history": []
    }
  ]
}
